,0,v1
2243,urgent 2nd attempt contact u u å 1000call 09071512432 b4 300603t csbcm4235wc1n3xx callcost150ppmmobilesvari maxå 7 50,ham
2246,know shall speak lt gt minut,spam
2247,thank understand tri tell sura,spam
2248,sure result offer,ham
2249,ì_ go buy wif meet ì_ later,spam
2250,hcl chennai requir fresher voic process excel english need salari upto lt gt call ms suman lt gt telephon interview via indyarock com,ham
2251,one joy lifei wake daywith thought somewheresomeon care enough tosend warm morn greet,ham
2253,dunno lei thk mum lazi go neva ask yet,ham
2254,normal,ham
2255,ok great thanx lot,ham
2256,shall get pouch,ham
2257,carlo take sweet time usual let know patti done want smoke tell haul ass,ham
2258,get ten billion call text help god,ham
2260,want custom offic discount oh,spam
2261,almost see u sec,ham
2262,reach offic around lt decim gt amp mobil problem cann get voic call asa free,ham
2265,u r winner u ave special select 2 receiv å 1000 cash 4 holiday flight inc speak live oper 2 claim 0871277810710p min 18,ham
2266,hi probabl much fun get messag thought id txt u co im bore jame fart night,spam
2267,û got salt rub open wound like,ham
2268,ok bag,spam
2269,gimm lt gt minut ago,ham
2270,sm auction nokia 7250i get win free auction take part send nokia 86021 hg suite342 2land row w1jhl 16,ham
2271,channel,ham
2272,free video camera phone half price line rental 12 mth 500 cross ntwk min 100 txt call mobileupd8 08001950382 call2optout 674,ham
2274,compliment away system side,ham
2275,latest nokia mobil ipod mp3 player å 400 proze guarante repli win 83355 norcorp ltd å 1 50 mtmsgrcvd18,ham
2278,busi tri finish new year look forward final meet,ham
2279,still havent collect dough pl let know go place sent get control number,ham
2280,someon u know ask date servic 2 contact cant guess call 09058091854 reveal po box385 m6 6wu,ham
2281,babe talk think good boy miss love,ham
2282,agre stop thinkin ipad pleas ask macho question,ham
2283,perhap much easi give account identif tomorrow uni,ham
2285,one small prestig problem,ham
2286,came look flat seem ok 50 away alot wiv work got woman come 6 30,ham
2288,happi new year u ur famili may new year bring happi stabil tranquil ur vibrant colour life,ham
2289,yeah leav mayb 7ish,spam
2290,got tallent wast,ham
2291,decemb mobil 11mth entitl updat latest colour camera mobil free call mobil updat vco free 08002986906,ham
2292,lol great im get hungri,ham
2293,sun cant come earth send luv ray cloud cant come river send luv rain cant come meet u send care msg u gud evng,ham
2294,thank messag realli appreci sacrific sure process direct pay find way back test tomorrow class wonder day,spam
2295,4 costa del sol holiday å 5000 await collect call 09050090044 toclaim sae tc pobox334 stockport sk38xh costå 1 50 pm max10min,ham
2296,audri lousi autocorrect,spam
2297,oh forward messag thought send,ham
2298,multipli number independ count decim point divis push decim place like show,ham
2299,releas anoth italian one today cosign option,spam
2300,r u meet da ge nite tmr,ham
2301,whatev juliana whatev want,ham
2302,hiya stu wot u 2 im much trubl home moment evon hate even u wot hell av done wont u tell text bck pleas luv dan,ham
2303,remain unconvinc elabor test willpow,ham
2304,think chennai forgot come auction,ham
2305,watch tv lor nice one like lor,ham
2307,rememb ask alex pizza,spam
2308,07801543489 guarante latest nokia phone 40gb ipod mp3 player å 500 prize txt word collect 83355 tc llc ny usa 150p mt msgrcvd18,spam
2309,come ur home,ham
2310,ìï takin linear algebra today,spam
2311,enter cabin pa said happi b day boss felt special askd 4 lunch lunch invit apart went,spam
2315,1 finish meet call,ham
2316,know dad back,ham
2318,lol u still feel sick,ham
2319,hi shanil rakhesh thank exchang uncut diamond stuff leav back excel servic dino prem,ham
2320,1000 girl mani local 2 u r virgin 2 r readi 2 4fil ur everi sexual need u 4fil text cute 69911 å 1 50p,ham
2322,master buy bb co sale bf,ham
2323,sorri call later meet,ham
2324,certainli put thing perspect someth like happen,ham
2325,themob hit link get premium pink panther game new 1 sugabab crazi zebra anim badass hoodi wallpap 4 free,ham
2326,hi got money da,ham
2327,lol mad first woke gave,spam
2331,much textin bout,ham
2332,winner u special select 2 receiv å 1000 cash 4 holiday flight inc speak live oper 2 claim 0871277810810,ham
2333,mm way railway,ham
2334,sea lay rock rock envelop envelop paper paper 3 word,ham
2335,bore housew chat n date 0871750 77 11 bt nation rate 10p min landlin,ham
2336,r u yet wear blue shirt n black pant,ham
2337,hello madam,ham
2338,keep ten rs shelf buy two egg,ham
2339,quit late lar ard 12 anyway wun b drivin,ham
2340,ok much though h friday cant wait dunno wot hell im gonna anoth 3 week becom slob oh wait alreadi done,ham
2342,well weather cali great complex great need car move freeli tax outrag great place sad part miss home,spam
2343,late,ham
2344,aunti huai juan never pick phone,ham
2345,ok lor ì_ reach messag,ham
2346,hi babe im home wanna someth xx,ham
2349,hi 07734396839 ibh custom loyalti offer new nokia6600 mobil å 10 txtauction txt word start 81151 get 4t,ham
2350,ok may free gym,ham
2352,give sec think think,ham
2353,wanna get laid 2nite want real dog locat sent direct ur mobil join uk largest dog network txt park 69696 nyt ec2a 3lp å 1 50 msg,spam
2354,done,ham
2355,hi dude hw r u da reali mise u today,ham
2356,oki,ham
2358,want show world princess europ,ham
2359,yeah pretti much best case scenario,spam
2360,freemsg txt call 86888 claim reward 3 hour talk time use phone subscribe6gbp mnth inc 3hr 16 stop txtstop,ham
2361,studi alon without anyon help cant need studi,ham
2362,call say come today ok tell fool like ok,ham
2363,ì_ wait 4 bu stop aft ur lect lar dun c ì_ go get car come back n pick ì_,spam
2365,hang brother famili,ham
2367,oh rite well im best mate pete went 4 week 2geva longer week,ham
2368,rememb hurt day satan impost need pay price may destini keep go u said pray get mind get,ham
2371,lot sick thing go round take easi hope u feel better soon lol,ham
2372,meant calcul lt gt unit lt gt school realli expens start practic accent import decid 4year dental school nmde exam,ham
2373,erm woodland avenu somewher get parish magazin telephon number,spam
2374,run manag 5 minut need oxygen might resort roller option,ham
2375,ye realli great bhaji told kalli best cricket sachin world tough get,ham
2376,great role model give much realli wish day miracl god reason everyth must say wish knew dont look sinc young still great day,ham
2378,cancer mom make big deal regular checkup aka pap smear,ham
2379,whore unbeliev,ham
2381,shant disturb u anymor jia,ham
2382,guess want alon time could show watch,ham
2383,detroit home snow enjoy,ham
2385,need ke qi ìï bore izzit suddenli thk,spam
2386,machan go gym tomorrow wil come late goodnight,ham
2389,get ur 1st rington free repli msg tone gr8 top 20 tone phone everi week å 1 50 per wk 2 opt send stop 08452810071 16,ham
2390,call later network urgnt sm,ham
2391,sent de webadr gete salari slip,ham
2392,watch tv lor,ham
2393,sorri call later,ham
2394,urgent tri contact last weekend draw show å 900 prize guarante call 09061701851 claim code k61 valid 12hour,ham
2395,like lt gt question,ham
2396,ye mum lookin strong,ham
2397,09066362231 urgent mobil 07xxxxxxxxx å 2 000 bonu caller prize 02 06 03 2nd attempt reach call 09066362231 asap,ham
2398,aight time want come,ham
2399,want explicit sex 30 sec ring 02073162414 cost 20p min,ham
2400,call u done,ham
2401,contract mobil 11 mnth latest motorola nokia etc free doubl min text orang tariff text ye callback remov record,spam
2403,okay soon best,ham
2404,bar b q store life twat orang dungere came ask want deck got first punch,ham
2405,erm thought contract ran the4th octob,ham
2407,u know stubborn even want go hospit kept tell mark weak sucker hospit weak sucker,ham
2408,hi mobil lt gt ad contact list www fullonsm com great place send free sm peopl visit fullonsm com,ham
2409,let know need anyth els salad desert someth mani beer shall get,ham
2410,spoon okay,ham
2411,rose red red blood blood heart heart u u send ti ur friend includ u like u get back 1 u r poor relat 2 u need 1 support 3 u r frnd 2 mani 4 some1 luv u 5 some1 pray god marri u tri,ham
2412,dear u invit xchat final attempt contact u txt chat 86688,spam
2413,macha dont feel upset assum mindset believ one even wonder plan us let life begin call anytim,ham
2414,noe da car later c lar wear short,ham
2415,urgent mobil 077xxx å 2 000 bonu caller prize 02 06 03 2nd attempt reach call 09066362206 asap box97n7qp 150ppm,ham
2416,didnt complet gist oh,ham
2418,ye post coupl pic fb still snow outsid wake,ham
2419,hey almost forgot happi b day babe love ya,spam
2420,reach home tire come tomorro,ham
2421,hey anyway,ham
2423,answerin phone actual pretti reason hour sleepi,ham
2424,creepi crazi,ham
2425,made eta taunton 12 30 plan hope û still okday good see xx,ham
2426,love brother time talk english grin say hey muhommad penni say hello across sea,spam
2427,alex say ok ok,ham
2428,hi neva worri bout da truth coz truth lead 2 ur heart itåõ least uniqu person like u deserv sleep tight morn,ham
2429,yeah got one line us,spam
2430,full heat pa appli oil pa,ham
2431,u town alon,ham
2432,r u sam p eachoth meet go 2 hous,ham
2433,ok pop ask bout someth said around tonght wen girl come,ham
2434,mmm fuck merri christma,ham
2435,regist sinco paye log icicibank com enter urn lt gt confirm bewar fraud share disclos urn anyon,ham
2437,got ten buck jay noncomitt,spam
2438,hi u want join st later meet five call u class,ham
2441,friendship game play word say start march end may tomorrow yesterday today e,ham
2442,yup ok go home look time msg ì_ xuhui go learn 2nd may lesson 8am,ham
2443,want cock hubbi away need real man 2 satisfi txt wife 89938 string action txt stop 2 end txt rec å 1 50ea otbox 731 la1 7w,ham
2444,hi yiju meet u 11 tmr,ham
2446,huh hyde park mel ah opp got confus anyway tt e best choic den juz take,ham
2448,ah see lingo let know wot earth finish make,ham
2449,urgent mobil 07xxxxxxxxx å 2 000 bonu caller prize 02 06 03 2nd attempt reach call 09066362231 asap box97n7qp 150ppm,ham
2450,babe hope ok shit night sleep fell asleep 5 iåõm knacker iåõm dread work tonight thou upto tonight x,ham
2451,cant see join deni mina deni want alon time,ham
2452,size eleph tablet u shove um ur ass,ham
2453,mobil 10 mth updat latest orang camera video phone free save å free text weekend call text ye callback orno opt,ham
2454,night end anoth day morn come special way may smile like sunni ray leav worri blue blue bay gud mrng,ham
2455,happi new year hope good semest,ham
2457,haf enuff space got like 4 mb,ham
2459,hey tmr meet bugi 930,ham
2460,went fast asleep dear take care,ham
2461,let math good,ham
2464,free 1st week entri 2 textpod 4 chanc 2 win 40gb ipod å 250 cash everi wk txt pod 84128 ts cs www textpod net custcar 08712405020,ham
2466,urgent tri contact u today draw show å 2000 prize guarante call 09066358361 land line claim y87 valid 12hr,ham
2467,glad see repli,ham
2468,want send virtual hug need one,ham
2469,day class class,ham
2470,told return order,ham
2472,2 celebr båõday els,spam
2474,webpag avail,ham
2475,wud never mind u dont miss u dont need u wil realli hurt wen u need amp u dont tell take care,ham
2476,fffff text kadeem far gone,ham
2478,wat make peopl dearer de happi dat u feel u meet de pain u feel u miss dem,ham
2479,time fix spell sometim get complet diff word go figur,spam
2482,5 free top polyphon tone call 087018728737 nation rate get toppoli tune sent everi week text subpoli 81618 å 3 per pole unsub 08718727870,ham
2483,would great guild could meet bristol road somewher get touch weekend plan take flight good week,ham
2485,also know lunch menu da know,ham
2489,hey iouri gave number wyli ryan friend,ham
2490,tri call repli sm video mobil 750 min unlimit text free camcord repli call 08000930705,ham
2491,wanna art,ham
2492,drive train,ham
2493,wot student discount u get book,ham
2494,nice day impress sensibl went home earli feel fine bore rememb,ham
2496,serious spell name,ham
2498,x cours 2yr messag messeng lik r send,ham
2499,ask princess,ham
2500,come right ahmad,ham
2501,guy ask get slipper gone last year,ham
2502,free2day sexi st georg day pic jordan txt pic 89080 dont miss everi wk sauci celeb 4 pic c pocketbab co uk 0870241182716 å 3 wk,ham
2503,first gain lt gt kg sinc took second done blood sugar test ok blood pressur within normal limit worri,ham
2504,u reckon need 2 arrang transport u thank,ham
2505,07732584351 rodger burn msg tri call repli sm free nokia mobil free camcord pleas call 08000930705 deliveri tomorrow,ham
2506,thanx 4 send home,ham
2507,hey rite u put åè10 evey mnth,ham
2508,electr went fml,ham
2509,bad girl ladi,ham
2510,sorri call later,ham
2511,womdarful actor,ham
2512,hey inconveni si huh,ham
2513,six chanc win cash 100 20 000 pound txt csh11 send 87575 cost 150p day 6day 16 tsandc appli repli hl 4 info,spam
2514,ye babi studi posit kama sutra,ham
2516,littl med say take everi 8 hour 5 pain back took anoth hope die,ham
2517,train back northampton afraid,ham
2520,gonna blake night might abl get littl earli,ham
2521,say explicitli told nora know someon probabl gonna bother,ham
2522,thanx 4 2day u r goodmat think ur rite sari asusu 1 u cheer love u franyxxxxx,ham
2523,b4u voucher w c 27 03 marsm log onto www b4utel com discount credit opt repli stop custom care call 08717168528,ham
2524,ye da plm ur offic,spam
2525,love decis feel could decid love life would much simpler less magic,ham
2526,urgent tri contact u today draw show å 800 prize guarante call 09050001808 land line claim m95 valid12hr,ham
2528,dare chang ring,ham
2529,lt gt fast approach wish u happi new year happi sankranti happi republ day happi valentin day happi shivratri happi ugadi happi fool day happi may day happi independ day happi friendship mother father teacher children day amp happi birthday 4 u happi ganesh festiv happi dasara happi diwali happi christma lt gt good morn afternoon even night rememberi first wish u raj,ham
2530,hi juan im come home fri hey cours expect welcom parti lot present ill phone u get back load love nicki x x x x x x x x x,ham
2532,keep go never intent run choos rather keep room clean say visitor mayb best choic ye want embarass mayb feel feel friend want drop buy say happen morn tri everyth know els,ham
2533,waaaat lololo ok next time,ham
2535,alright see bit,ham
2537,one talk,ham
2538,sm ac blind date 4u rodds1 21 aberdeen unit kingdom check http img sm ac w icmb3cktz8r7 4 blind date send hide,ham
2539,cool breez bright sun fresh flower twitter bird wait wish u goodmorn amp nice day,ham
2540,alway yahoo messeng send messag get may send mobil mode sha get repli,ham
2541,need drug anymor,ham
2542,fuck cedar key fuck come anyway tho,ham
2543,actual send remind today wonder weekend,ham
2544,k work someth,ham
2545,height confid aeronaut professor wer calld amp wer askd 2 sit aeroplan aftr sat wer told dat plane ws made student dey hurri plane bt 1 didnt move said made student,ham
2546,idk sit stop shop park lot right bawl eye feel like failur everyth nobodi want feel like fail,ham
2547,call see facebook huh,spam
2548,still custom place,ham
2551,road cant txt,ham
2552,quit ok bit ex u better go eat smth els feel guilti,ham
2553,baaaaab misss youuuuu go teach class 5,ham
2555,u reach orchard alreadi u wan 2 go buy ticket first,spam
2556,time come,ham
2557,heard abt tat,spam
2558,nope that fine might nap tho,ham
2559,like think alway possibl pub later,ham
2560,found way get anoth app phone eh go net cafe take job geeee need babe crave see,ham
2562,fine thatåõ way u feel thatåõ way gota b,ham
2563,0a network allow compani bill sm respons supplier,ham
2564,dad gonna call get work ask crazi question,ham
2565,class lt gt reunion,ham
2566,vl bcum difficult,ham
2567,urgent last weekend draw show å 1000 cash spanish holiday call 09050000332 claim c rstm sw7 3ss 150ppm,ham
2568,toshiba porteg m100 gd,ham
2569,doesnt need test,ham
2572,plm come da way,ham
2573,nite nite pocay wocay luv u n e thing 4eva promis ring u 2morrowxxxx,spam
2574,hey mr what name bill brison book one languag word,spam
2577,mean still think teju,ham
2578,height recycl read twice peopl spend time earn money money spent spend time good morn keep smile,ham
2579,freez home yet rememb kiss mom morn love think miss yet,ham
2580,think da wil,spam
2581,that bit weird even suppos happen good idea sure pub,ham
2582,dear hero leav qatar tonit apt opportun pl keep touch lt email gt kerala,spam
2583,dear good morn feel dear,ham
2584,nokia 7250i get win free auction take part send nokia 86021 hg suite342 2land row w1jhl 16,ham
2586,r meet,ham
2587,ur balanc å 500 ur next question sang uptown girl 80 2 answer txt ur answer 83600 good luck,ham
2588,record indic u mayb entitl 5000 pound compens accid claim 4 free repli claim msg 2 stop txt stop,ham
2590,lmao fish memori need,ham
2591,alway even spirit get bb soon tri sure need,ham
2592,dad back ph,ham
2593,dear friend sorri late inform today birthday love ar praveesh detail log face book see number lt gt dont miss delici treat,ham
2595,call messag miss call,spam
2596,dint tell anyth angri told abi,ham
2597,sister clear two round birla soft yesterday,ham
2599,offic call lt gt min,ham
2600,pete pleas ring meiv hardli gotani credit,ham
2601,û_ r stayin extra week back next wed rugbi weekend hi c u soon ham,ham
2602,love one law make happi person love way friendship one law never make ur friend feel alon aliv gud night,ham
2604,look forward sex cuddl two sleep,ham
2605,project pa come,ham
2606,yeah probabl earlier,ham
2607,congratul u claim 2 vip row ticket 2 c blu concert novemb blu gift guarante call 09061104276 claim ts cs www smsco net costå 3 75max,ham
2608,im gloucesterroad uup later,ham
2609,tuition 330 hm go 1120 1205 one mind,ham
2610,good day mine realli busi much tomorrow night,ham
2611,talk other probabl come earli tomorrow,spam
2612,44 7732584351 want new nokia 3510i colour phone deliveredtomorrow 300 free minut mobil 100 free text free camcord repli call 08000930705,ham
2613,al moan n e thin goe wrong fault al de argument r fault fed himso bother hav 2go thanx xx,ham
2614,call later network urgnt sm,ham
2616,boltblu tone 150p repli poli mono eg poly3 1 cha cha slide 2 yeah 3 slow jamz 6 toxic 8 come stop 4 tone txt,ham
2617,spend day wait ideal path appear front us forget path made walk wait goodnight,ham
2618,borderlin yeah whatev,ham
2619,hous maid murder coz man murder lt gt th januari public holiday govt instituit close includ post offic understand,spam
2620,74355 xma iscom ur award either å 500 cd gift voucher free entri 2 r å 100 weekli draw txt music 87066 tnc,ham
2621,ya told ask wat matter,ham
2622,hey girl r u hope u r well del r bak long time c give call sum time lucyxx,ham
2623,hey realli pretti late want go lesson first join reach tp mrt,ham
2624,g w r,ham
2625,ok problem yup go sch 4 rem correctli,spam
2626,know peopl still town,ham
2627,great princess think,ham
2628,affidavit say lt gt e twigg st divis g courtroom lt gt lt time gt doubl check text tomorrow,ham
2629,life mean lot love life love peopl life world call friend call world ge,ham
2630,lt gt pple marri lover becz hav gud undrstndng dat avoid problem sent di 2 u u wil get gud news friday person like tomorrow best day life dont break chain break suffer send lt gt frnd lt gt min whn u read,ham
2631,lol ye friendship hang thread caus u buy stuff,spam
2632,come home class right need work shower,ham
2633,good let thank god pleas complet drug lot water beauti day,ham
2634,erutupalam thandiyachu,ham
2635,win newest ûïharri potter order phoenix book 5 repli harri answer 5 question chanc first among reader,ham
2636,dorothi kiefer com bank granit issu strong buy explos pick member 300 nasdaq symbol cdgt 5 00 per,ham
2637,thanx yup come back sun finish dinner go back 2 hotel time fli tog 4 exactli mth today hope haf mani mth come,ham
2638,babe need advic,ham
2639,princess like make love lt gt time per night hope that problem,ham
2643,u got person stori,ham
2644,also maaaan miss,ham
2645,how watch resiz,ham
2647,quit lor dun tell wait get complac,ham
2648,make tonight,ham
2649,hope great new semest wish best made great,ham
2651,noth,ham
2652,thanx,ham
2653,think fix send test messag,ham
2655,ju an lar u noe later,ham
2656,ding ya break fassyol blacko londn,ham
2657,poyyarikatur kolathupalayam unjalur post erod di lt gt,ham
2659,theoret yeah could abl come,ham
2660,ì_ wan go c doctor,ham
2661,yup ok,ham
2665,hiya how go sunni africa hope u r avin good time give big old silver back big kiss,ham
2666,infact happi new year see,ham
2667,wen u miss someon,ham
2668,mmm that better got roast iåõd b better drink 2 good indian,spam
2671,will go aptitud class,ham
2672,check choos babe video sm shsex netun fgkslpopw fgkslpo,ham
2674,peopl dog area call 09090204448 join like mind guy arrang 1 1 even aå 1 50 minapn ls278bb,ham
2675,got messag ignor ye shop,ham
2676,let know contact settl room let know ok,ham
2678,prepar pleasur,ham
2679,ey calm downon theacus itxt u co iwana know wotu r doin thew end haventcn u age ring ur up4 neth sat love j xxx,spam
2680,wonder got onlin love gone net cafe get phone recharg friend net think boytoy,ham
2681,freemsg hi babi wow got new cam mobi wanna c hot pic fanci chat im w8in 4utxt rpli chat 82242 hlp 08712317606 msg150p 2rcv,ham
2682,free nokia motorola upto 12mth 1 2price linerent 500 free x net min 100txt mth free b tooth call mobileupd8 08001950382 call 2optout d3wv,ham
2683,princess bet brotha chase,ham
2684,7 go ok na,ham
2685,fine send greet,spam
2686,that cool day,ham
2687,one day billion class right,ham
2688,lol right diet everyday cheat anyway meant fatti,ham
2689,anyth lor toa payoh got place 2 walk meh,ham
2690,believ attach see everi day know best get babe go teach class midnight,spam
2691,k k cant come search job,ham
2692,cinema plu drink appeal tomo fr thriller director like mac 8 30,spam
2693,lick everi drop readi use mouth well,ham
2694,get 3 lion england tone repli lionm 4 mono lionp 4 poli 4 go 2 www rington co uk origin n best tone 3gbp network oper rate appli,ham
2695,india go draw seri mani year south african soil,ham
2696,donat å 2 50 unicef asian tsunami disast support fund text donat 864233 å 2 50 ad next bill,ham
2697,1 000 cash 2 000 prize claim call09050000327,ham
2698,money issu weigh thank breath easier make sure dont regret thank,spam
2699,wewa 130 iriv 255 128 mb,ham
2700,hi ami send free phone number coupl day give access adult parti,ham
2701,ye one woman man pleas tell like dislik bed,ham
2702,hit move,ham
2703,sorri call later,ham
2704,hungri buy smth home,spam
2705,oh ho first time u use type word,ham
2706,parti place usf charg contribut way greatli appreci yeah got room one,ham
2707,brother geniu,spam
2708,good think could send pix would love see top bottom,ham
2709,wanna watch movi,ham
2710,ye princess want make happi,spam
2711,eh den sat u book e kb liao huh,ham
2712,want talk,ham
2713,rington club get uk singl chart mobil week choos top qualiti rington messag free charg,ham
2715,home pleas call,ham
2716,importantli discuss u,ham
2717,urgent tri contact u today draw show å 800 prize guarante call 09050001808 land line claim m95 valid12hr,ham
2718,like italian food,spam
2719,well know mean text,ham
2720,neft transact refer number lt gt rs lt decim gt credit beneficiari account lt gt lt time gt lt gt,ham
2722,felt convey reason ese,ham
2724,û give fli monkey wot think certainli û mind friend mine,ham
2725,sent email ûò address incomm right,ham
2728,yeah sure thing mate haunt got stuff sort im go sound anyway promot hex way dont know number joke,spam
2729,time come tomorrow,spam
2730,yeah go bed back midnight,ham
2731,catch bu fri egg make tea eat mom left dinner feel love,ham
2733,ran younger man make pretti babi togeth,ham
2734,come mahal bu stop lt decim gt,ham
2735,sir late pay rent past month pay lt gt charg felt would inconsider nag someth give great cost didnt speak howev recess wont abl pay charg month henc askin well ahead month end pleas help thank,ham
2736,yet chikku k wat abt tht guy stop irrit msging u,ham
2737,k k much cost,ham
2738,tomarrow want got court lt decim gt come bu stand 9,ham
2739,see forward messag proof,ham
2740,http tm widel com index wml id 820554ad0a1705572711 first trueåác c ringtoneåá,ham
2741,lolnic went fish water,spam
2743,opposit side drop,ham
2744,guess worri must know way bodi repair quit sure worri take slow first test guid ovul relax noth said reason worri keep followin,ham
2745,dunno da next show aft 6 850 toa payoh got 650,ham
2747,ok tri week end cours coimbator,ham
2748,sorri vikki watch olav mandara movi kano trishul theatr wit frnd,ham
2751,take care financi problem help,ham
2752,thank rington order refer t91 charg gbp 4 per week unsubscrib anytim call custom servic 09057039994,ham
2754,best line said love wait till day forget u day u realiz u cannot forget gn,ham
2756,better made friday stuf like pig yesterday feel bleh least writh pain kind bleh,ham
2757,wanna gym,ham
2758,2mro come gym machan goodnight,ham
2761,ok later show around 8 8 30 want cld drink wld prefer spend money nosh mind nxt wk,ham
2762,anyth lor,ham
2763,wat time ì_ finish,ham
2764,havent stuck orchard dad car go 4 dinner u leh r free tonight,ham
2765,funer home audrey dad,ham
2766,march end readi call sure problem capit never complet far work ladi,spam
2768,messag responc happend,ham
2769,jay say doubl faggot,spam
2771,first strike red one bird antelop begin toplay fieldof selfindepend believ flower content grow random,ham
2772,total disappoint text craziest shit got,ham
2773,sweetheart hope kind day one load reason smile biola,spam
2774,tee hee lectur cheeri bye bye,ham
2776,r still meet 4 dinner tonight,ham
